Artist,Title,Lyrics
Doja Cat,Need to Know,"[Intro]
Yeah
[Chorus]
Wanna know what it's like (Like)
Baby, show me what it's like (Like)
I don't really got no type (Type)
I just wanna fuck all night
Yeah-yeah, oh-woah-woah (Oh, ooh, mmm)
Baby, I need to know, mmm (Yeah, need to know)
I just been fantasizin' (Size)
And we got a lotta time (Time)
Baby, come throw the pipe (Pipe)
Gotta know what it's like (Like)
Yeah-yeah, oh-woah-woah
Baby, I need to know, mmm
[Verse 1]
What's your size? (Size)
Add, subtract, divide ('Vide)
Daddy don't throw no curves (Curves)
Hold up, I'm goin' wide (Wide)
We could just start at ten (Ten)
Then we can go to five (Five)
I don't play with my pen (Pen)
I mean what I writе
Yeah-yeah, woah-woah-woah
I just can't help but bе sexual (Oh)
Tell me your schedule (Yeah)
I got a lotta new tricks for you, baby
Just sayin' I'm flexible (I will)
I do what I can to get you off (I will)
Might just fuck him with my makeup on (I will)
Eat it like I need an apron on (Yeah, oh)
Eat it 'til I need to change my thong (Yeah, ayy)
We could do it to your favorite song (Yeah, ayy)
Take a ride into the danger zone
You know my nigga be buggin' me
I just be wonderin' if you can fuck on me better
Itchin' for me like an ugly sweater
Need it in me like a Chuck E. need cheddar
I need to know
[Chorus]
Wanna know what it's like (Like)
Baby, show me what it's like (Like)
I don't really got no type (Type)
I just wanna fuck all night
Yeah-yeah, oh-woah-woah (Oh, ooh, mmm)
Baby, I need to know, mmm (Yeah, need to know)
I just been fantasizin' (Size)
And we got a lotta time (Time)
Baby, come throw the pipe (Pipe)
Gotta know what it's like (Like)
Yeah-yeah, oh-woah-woah
Baby, I need to know, mmm
[Bridge]
You're exciting, boy, come find me
Your eyes told me, ""Girl, come ride me""
Fuck that feeling both us fighting
Could he try me? (Yeah) Mmm, most likely
[Verse 2]
Tryna see if you could handle this ass
Prolly give his ass a panic attack
Sorry if I gave a random erection
Prolly thinkin' I'm a telekinetic
Oh, wait, you a fan of the magic?
Poof, pussy like an Alakazam
I heard from a friend of a friend
That that dick was a ten out of ten
I can't stand it, just one night me
Clink with the drink, gimme a sip
Tell me what's your kink, gimme the dick
Spank me, slap me, choke me, bite me (Ew)
Oh, wait, I can take it (Ah)
Give a fuck 'bout what your wifey's sayin' (Yeah)
[Chorus]
Wanna know what it's like (Like)
Baby, show me what it's like (Like)
I don't really got no type (Type)
I just wanna fuck all night
Yeah-yeah, oh-woah-woah (Oh, ooh, mmm)
Baby, I need to know, mmm (Yeah, need to know)
I just been fantasizin' (Size)
And we got a lotta time (Time)
Baby, come throw the pipe (Pipe)
Gotta know what it's like (Like)
Yeah-yeah, oh-woah-woah
Baby, I need to know, mmm"
Edward Maya,Stereo Love,"[Intro: Vika Jigulina]
When you gonna stop breaking my heart?
I don't wanna be another one
Praying for the things I never done
Don't let go, don't let go, don't, my love
[Verse: Vika Jigulina]
Can I get to your soul?
Can you get to my flow?
Can we promise we won't let go?
All the things that I need
All the things that you need
You can make it feel so real
[Pre-Chorus: Vika Jigulina & Edward Maya]
'Cause you can't deny, you've blown my mind
When I touch your body, I feel I'm losing control
'Cause you can't deny, you've blown my mind
When I see you, baby, I just don't wanna let go
[Chorus: Edward Maya]
I hate to see you cry, your smile is a beautiful lie
I hate to see you cry, my love is dying inside
[Post-Chorus: Edward Maya]
I can fix all those lies
Oh, baby, babe, I run, love, I'm running to you
You won't see me cry, I'm hiding inside
My heart is in pain, but I'm smiling for you
[Verse: Vika Jigulina]
Can I get to your soul?
Can you get to my flow?
Can we promise we won't let go?
All the things that I need
All the things that you need
You can make it feel so real
[Pre-Chorus: Vika Jigulina & Edward Maya]
'Cause you can't deny, you've blown my mind
When I touch your body, I feel I'm losing control
'Cause you can't deny, you've blown my mind
When I see you, baby, I just don't wanna let go
[Bridge: Vika Jigulina]
When you gonna stop breaking my heart?
Don't let go, don't let go to my love
[Chorus: Edward Maya]
I hate to see you cry, your smile is a beautiful lie
I hate to see you cry, my love is dying inside
I hate to see you cry, my love is dying inside
I haven't seen you smiling, but I'm dying tonight
[Post-Chorus: Edward Maya]
I can fix all those lies
Oh, baby, babe, I run, love, I'm running to you
You won't see me cry, I'm hiding inside
My heart is in pain, but I'm smiling for you
[Outro: Edward Maya]
Oh, baby, I'll try to make things right
I need you more than air when I'm not with you
Please don't ask me why, just kiss me this time
My only dream is about you and I"
Billy Idol,Eyes Without A Face,"[Verse 1: Billy Idol]
I'm all out of hope
One more bad break could bring a fall
When I'm far from home
Don't call me on the phone to tell me you're alone
It's easy to deceive
It's easy to tease, but hard to get release
[Chorus: Billy Idol & 
Perri Lister
]
(
Les yeux sans visage
) Eyes without a face
(
Les yeux sans visage
) Eyes without a face
(
Les yeux sans visage
) Eyes without a face
Got no human grace, your eyes without a face
[Post-Chorus]
Ooh, ch-ch
[Verse 2: Billy Idol]
I spent so much time
Believing all the lies to keep the dream alive
Now it makes me sad
It makes me mad at truth for loving what was you
[Chorus: Billy Idol & 
Perri Lister
]
(
Les yeux sans visage
) Eyes without a face
(
Les yeux sans visage
) Eyes without a face
(
Les yeux sans visage
) Eyes without a face
Got no human grace, your eyes without a face
[Post-Chorus]
Ooh, ha
[Guitar Solo]
[Bridge: Billy Idol]
When you hear the music, you make a dip
Into someone else's pocket, then make a slip
Steal a car and go to Las Vegas
Ooh, the gigolo pool
Hanging out by the state line
Turning holy water into wine
Drinking it down
Oh-oh-oh
I'm on a bus on a psychedelic trip
Reading murder books, trying to stay hip
I'm thinking of you and you're out there, so
Say your prayers
Say your prayers
Say your prayers
Ooh
Ooh-ooh-ooh, ooh
[Verse 3: Billy Idol]
Now I close my eyes
And I wonder why I don't despise
Now all I can do
Is love what was once so alive and new
But it's gone from your eyes
I'd better realise
[Chorus: Billy Idol & 
Perri Lister
]
(
Les yeux sans visage
) Eyes without a face
(
Les yeux sans visage
) Eyes without a face
(
Les yeux sans visage
) Eyes without a face
Got no human grace, your eyes without a face
[Post-Chorus]
Such a human waste, your eyes without a face
[Outro: Billy Idol]
And now it's getting worse"
Beyoncé,AMERICA HAS A PROBLEM (feat. Kendrick Lamar),"[Intro: Kilo Ali]
America, America has a problem
[Verse 1: Kendrick Lamar]
(Lama)
Tourbillion watcher, pgLang caller, 9-11 slider
Look at my garage, it's synced up
Get the genie out the bottle and point at any model
(Lama)
What, wait, what? Ayy, what?
Go, Stink, fuck it up, go, Stink, fuck it up
Go, Stink, that's what's up, go, Stink, I'm in love
Hey, boo-boo, too much complexity to learn me from Google
My mama told me that the money outgrew you
My horoscope said I'm really out my noodle
I'm troublin', I'm puzzlin', it's sudoku
Say Bey, yes, America got a problem
Geeked up, choosy love, well, they chose violence
Universal, please don't play possum
I'm a businеss man doin' as follows
Truthfully, I be lyin' in my rap song
'Cause I always fail to mention I'd slap homiе
His career didn't come with no life insurance
Hope his day one fans got some facts on him
I'm an honorary Beyhive, let's see why
Them diamonds don't be fly, they all CGI
You better get it off your chest like breast reduction
If she stressed over you, she stressed for nothin'
Hold up, wait a minute
Even AI gotta practice clonin' Kendrick
The double entendre, the encore remnants
I bop like ten men, the opps need ten men
Billboard, they know (Out for her, ride or else)
After Hov, rightfully so (Bust for else, not us)
Simmer down, I go, I go (Culture, you got us, you got us)
[Verse 2: Beyoncé]
Heard you got that D for me
Pray your love is deep for me
I'ma make you go weak for me
Make you wait a whole week for me (For me)
I see you watchin', fiendin'
I know you want it, schemin'
I know you need it, drug lord
You want it on you? Don't I know
You need love, I need some too
Do you want this like it wants you?
[Refrain: Beyoncé]
Know that booty gon' do what it want to
Can't hit it one time, multiple
I know you see these rack-rack-racks on me
Now come and get hi-i-i-i-i-igh
Twenty, forty, eighty out the trap, hit it with the rap
Put it on the map, then we right back
Call me when you wanna get hi-i-i-igh
Tony Montana with the racks
Ivy P on my bag, double G's on my dash
Nigga, I'm bad, I'm bad
Tell me when you wanna get hi-i-i-igh
[Pre-Chorus: Beyoncé & 
Kendrick Lamar
]
Boy, you can't get no higher than this, no, 
no
'Cause love don't get no higher than this, no, 
no
, no, 
no, no
[Chorus: Beyoncé]
Grind (Grind)
Boy, you know I grind (Grind)
When I pull up these jeans, you're mine (When I pull up these jeans, you're mine)
You're mine (You're mine, you're mine)
When I step on the scene, they
Can't wait to back it up
Your ex-dealer dope, but it ain't crack enough
I'm supplying my man, I'm in demand soon as I land
Just know I roll with them goons (Goons)
In case you start acting familiar
This kind of love, big business
Whole slab, I kill for
[Pre-Chorus: Beyoncé & 
Kendrick Lamar
]
Boy, you can't get no higher than this, no (Higher)
'Cause love don't get no higher than this, no, 
no
, no, 
no, no
[Chorus: Beyoncé]
Grind (Grind)
Boy, you know I grind (Grind)
When I pull up these jeans, you're mine (When I pull up these jeans, you're mine)
You're mine (You're mine, you're mine)
When I step on the scene, they
Can't wait to back it up
Your ex-dealer dope, but it ain't crack enough
I'm supplying my man, I'm in demand soon as I land
Just know I roll with them goons (Goons)
In case you start acting familiar
This kind of love, big business
Whole slab, I kill for
[Refrain: Beyoncé, 
Kendrick Lamar
, 
Beyoncé & Kendrick Lamar
]
Know that booty gon' do what it want to (
Fam
)
Can't hit it one time, multiple (
Yam
)
I know you see these rack-rack-racks on me (
Racks
)
Now come and get hi-i-i-i-i-igh
Twenty, forty, eighty out the 
trap
, hit it with the 
rap
Put it on the 
map
, then we right back (
Run it back
)
Call me when you wanna get hi-i-i-igh
Tony Montana with the 
racks
Ivy P on my bag, double G's on my 
dash
Nigga, I'm bad, I'm bad (
Yeah, yeah, yeah
)
Tell me when you wanna get hi-i-i-igh (
I'm bad
)"
Dominic Fike,Come Here,"[Chorus]
Baby, come here
I get so lonely at night
[Verse]
Why can't you tell that I'm desperate?
Doesn't it show in my smile?
Why can't you tell that I'm bad for ya?
It doesn't show in your eyes
(Oh, cool) Oh, you're so cool
I wish I was you
So why can't you tell me
What you think I should do?
[Bridge]
So why can't you tell me
What you think I should do?
[Chorus]
Baby, come here
I get so lonely at night"
Arctic Monkeys,Fireside,"[Verse 1]
I can't explain but I wanna try
There's this image of you and I
And it goes dancing by
In the morning and in the night time
There's all these secrets that I can't keep
Like in my heart there's that hotel suite
And you lived there so long
It's kind of strange now you're gone
[Chorus]
I'm not sure if I should show you what I've found
Has it gone for good, or is it coming back around?
Isn't it hard to make up your mind
When you're losing and your fuse is fireside?
[Verse 2]
There's all those places we used to go
And I suspect you already know
But that place on memory lane you like still looks the same
But something about it's changed
[Chorus]
I'm not sure if I should show you what I've found
Has it gone for good, or is it coming back around?
Isn't it hard to make up your mind
When you're losing and your fuse is fireside?
[Bridge]
And I thought I was yours forever
Or maybe I was mistaken
But I just cannot manage to make it through the day
Without thinking of you lately
[Instrumental Break]
[Chorus]
I'm not sure if I should show you what I've found
Has it gone for good, or is it coming back around?
Isn't it hard to make up your mind
When you're losing and your fuse is fireside?"
Cage The Elephant,Tokyo Smoke,"[Verse 1]
Hey man
Hand me down with the crooked back
What's your father's name? Boy, you don't know where you're at
Pick yourself up, you don't look so good
Maybe you should lay down
Taught me how to fall
But you never told me I was supposed to stay down
[Chorus]
Stick and move
Sharpen up the knife
Keep it tight
Stay between the lines
Make your mark
Take your own advice
Don't be surprised when you trip and stumble
I played the fool again
My old unfaithful friend
Stick and move
Sharpen up the knife
Don't be surprised if you can't stay between the lines
[Verse 2]
Quicksand color blind in the hourglass
All spun out 'cause you can't stop looking back
Better stay still, don't you make a move
What'd you hope to find here?
Taught me how to fall
But you never told me I was meant to die here
[Chorus]
Stick and move
Sharpen up the knife
Keep it tight
Stay between the lines
Make your mark
Take your own advice
Don't be surprised when you trip and stumble
I played the fool again
My old unfaithful friend
Stick and move
Sharpen up the knife
Don't be surprised if you can't stay between the lines
[Outro]
Endless shot rounds
No smoking guns
Fizzled and faded
Now back on the run
My sticks and stones
Tokyo smoke
I played the fool 'til I started to choke
My public smile
My double face
Half in the light
Half in the shade
Need some fresh air
No place tonight
Guess I'll stay in and continue to fight
Lost, trace of trail
Spiderweb spun
Pale white and blue
Now I'm coming undone
Play sticks and stones
Three shades of black
Two steps away
And I can't get back"
J. Cole,No Role Modelz,"[Verse 1]
First things first: rest in peace, Uncle Phil
For real
You the only father that I ever knew
I get my bitch pregnant, I'ma be a better you
Prophecies that I made way back in the Ville
Fulfilled
Listen, even back when we was broke, my team ill
Martin Luther King woulda been on Dreamville, talk to a nigga
[Pre-Chorus]
One time for my L.A. sisters
One time for my L.A. ho
Lame niggas can't tell the difference
One time for a nigga who know
[Chorus]
Don't save her, she don't wanna be saved
Don't save her, she don't wanna be saved
Don't save her, she don't wanna be saved
Don't save her, she don't wanna be saved
[Verse 2]
No role models, and I'm here right now
No role models to speak of
Searchin' through my memory, my memory, I couldn't find one
Last night, I was gettin' my feet rubbed by the baddest bitch
Not Trina, but I swear to God
, 
this bitch'll make you call your girl up
And tell her, ""Hey, what's good?
Sorry, I'm never comin' home, I'ma stay for good""
Then hang the phone up and proceed to lay the wood
I came fast like 9-1-1 in white neighborhoods
Ain't got no shame 'bout it
She think I'm spoiled and I'm rich 'cause I can have any bitch
I got defensive and said, ""Nah, I was the same without it""
But then I thought back, back to a better me
Before I was a B-list celebrity
'Fore I started callin' bitches ""bitches"" so heavily
Back when you could get a platinum plaque without no melody, you wadn't sweatin' me
[Pre-Chorus]
One time for my L.A. sisters
One time for my L.A. ho
Lame niggas can't tell the difference
One time for a nigga who know
[Chorus]
Don't save her, she don't wanna be saved
Don't save her, she don't wanna be saved
Don't save her, she don't wanna be saved
Don't save her, she don't wanna be saved
[Verse 3]
I want a real love, dark-skinned Aunt Viv love
That Jada and that Will love
That leave a toothbrush at your crib love
And you ain't gotta wonder whether that's your kid love
Nigga, I don't want no bitch from reality shows
Out-of-touch-with-reality hoes
Out in Hollywood bringin' back five or six hoes
Fuck 'em then we kick 'em to the do', nigga, you know how it go
She deserved that, she a bird, it's a bird trap
You think if I didn't rap she would flirt back?
Takin' off her skirt, let her wear my shirt, 'fore she leave
""I'ma need my shirt back"" (Nigga, you know how it go)
[Pre-Chorus]
One time for my L.A. sisters
One time for my L.A. ho
Lame niggas can't tell the difference
One time for a nigga who know
[Chorus]
Don't save her, she don't wanna be saved
Don't save her, she don't wanna be saved
Don't save her, she don't wanna be saved
Don't save her, she don't wanna be saved
[Interlude: George W. Bush]
There's an old saying in Tennessee—I know it's in Texas, probably in Tennessee—that says, fool me once... shame on... shame on you
Fool me—can't get fooled again
[Bridge]
Fool me one time, shame on you (Ayy)
Fool me twice, can't put the blame on you (Ayy)
Fool me three times, fuck the peace sign
Load the chopper, let it rain on you (Bop, bop, bop)
Fool me one time, shame on you (Ayy)
Fool me twice, can't put the blame on you (Ayy)
Fool me three times, fuck the peace sign
Load the chopper, let it rain on you (Bop, bop, bop)
[Verse 4]
My only regret was too young for Lisa Bonet
My only regret was too young for Nia Long
Now all I'm left with is hoes from reality shows
Hand her a script, the bitch prolly couldn't read along
My only regret was too young for Sade Adu
My only regret, could never take Aaliyah home
Now all I'm left with is hoes up in Greystone
With the stale face 'cause they know it's they song
[Pre-Chorus]
She shallow but the pussy deep (She shallow
She shallow)
She shallow but the pussy deep (She shallow), yeah, ayy
(She shallow)
She shallow but the pussy deep (She shallow), haha
(She shallow)
She shallow but the pussy deep (She shallow
She shallow)
[Chorus]
Don't save her, she don't wanna be saved
Don't save her, she don't wanna be saved
Don't save her, she don't wanna be saved
Don't save her, she don't wanna be saved
Don't save her, she don't wanna be saved
Don't save her, she don't wanna be saved
Don't save her, she don't wanna be saved
Don't save her, she don't wanna be saved
[Produced by Phonix Beats & J. Cole]"
Dominic Fike,Why,"[Intro]
Yeah
[Chorus]
You ever wonder why-y-y-y-y? (Why)
Why-y-y-y-y? Why-y-y-y-y?
You ever wonder why-y-y-y-y? (Why)
Why-y-y-y-y? Why-y-y-y-y?
[Verse 1]
Said the lady with the long legs in the lawn chair
She like the strings on my guitar neck and my blonde hair
I write about her thighs in my latest lines
I remember her eyes when I asked her why
Why would you pay for this apartment you don't belong in?
You take this shit from all your bosses and all your boyfriends
I guess I get surprised when you let it slide
But it's no business of mine how you waste your time
Yeah
[Verse 2]
Don't crash, don't text, go renew your tags
No sex, no sleep, just that job
I bet you miss what you had
You can't get no sleep at night
Do you ever wonder why everyone is out to get you every day
Or do you question anything?
How many warnin' signs 'til it hits you, darling?
Gravity's your friend
You fall out of touch sometime
But your history calls you back to it again
Too many factors to be sure
So many reasons to think twice
And nobody asked you to before
[Chorus]
But do you ever wonder why-y-y-y-y? (Why)
Why-y-y-y-y? Why-y-y-y-y?
You ever wonder why-y-y-y-y? (Why)
Why-y-y-y-y? Why-y-y-y-y?
[Outro]
You ever wonder why?
Why, why?"
French Cassettes,Santa Cruz Tomorrow,"(Oh, South Carolina, Great Britain, oh)
Got tired of colds
Set my project on the doornail
While they both work on in soul
Everybody's got to eat, every-
Undo your tongue
Are you as sad as you are young?
Now you can tell me if I'm wrong
But I think you need some sleep
Yeah, I think you need some sleep
Yeah, I think you need some sleep
Yeah, I think you need some sleep
Yeah, I think you need some sleep
Yeah, I think you need some sleep
Yeah, I think you need some sleep
(South Carolina, Great Britain, oh
Oh, oh no)
Sunsets wait to war
Yeah, I think you need some sleep
Yeah, I think you need some sleep
Yeah, I think you need some sleep
Yeah, I think you need some sleep
(Yeah, I think you need some sleep) Why do you keep waking up to me?
(Yeah, I think you need some sleep
Yeah, I think you need some sleep) Yeah, why do you need to make it up to me?
(Yeah, I think you need some sleep
Yeah, I think you need some sleep) Yeah, why do you keep waking up to me?"
Phantogram,Black Out Days - Future Islands Remix,"[Verse 1]
Hide the sun
I will leave your face out of my mind
You should save your eyes
A thousand voices howling in my head
[Verse 2]
Speak in tongues
I don't even recognize your face
Mirror on the wall
Tell me all the ways to stay away
[Chorus 1]
Away-ay ya
Away-ay ya
And stay away-ay ya
Away-ay ya
Away-ay ya
[Verse 3]
Dig a hole
Fireworks exploding in my hands
If I could paint the sky
Would all the stars then shine a bloody red?
[Chorus 2]
Stay
Hey hey hey ah
Away hey ah
Away hey ah
And stay
Hey hey hey ah
Away hey ah
Away hey ah
[Refrain]
And stay
Hey hey hey ah (I’m hearing voices all the time and they're not mine)
Away hey ah
Away hey ah (I'm hearing voices and they’re haunting my mind)
And stay
Hey hey hey ah (I'm hearing voices all the time and they're not mine)
Away hey ah
Away hey ah (I'm hearing voices and they're haunting my mind)
[Outro]
Black out days
I don't recognize you anymore"
Elton John,Goodbye Yellow Brick Road - Remastered 2014,Lyrics Not Found
WILLOW,Wait a Minute!,"[Verse 1]
Wait a minute
I think I left my conscience on your front doorstep, oh oh
Wait a minute
I think I left my consciousness in the sixth dimension
But I'm here right now, right now
(Right now, right now)
Just sitting in a cloud, oh wow
I'm here right now, right now with you, oh wow, oh wow
(Right now, with you)
I don't even care
I’ll run my hands through your hair
You wanna run your fingers through mine
But my dreads too thick and that's alright
[Chorus]
Hold on, wait a minute
Feel my heart's intention, oh
Hold on, wait a minute
I left my consciousness in the sixth dimension
Left my soul in his vision
Let's go get it, oh, oh
Let's go get it, oh, oh
[Verse 2]
Some things don't work
Some things are bound to be
Some things, they hurt
And they tear apart me
You left your diary at my house
And I read those pages, do you really love me, baby?
Some things don't work
Some things are bound to be
Some things, they hurt
And they tear apart me
But I broke my word, and you were bound to see
And I cried at the curb
When you first said, ""Oel ngati kameie""
[Chorus]
Hold on, wait a minute (Oh)
Feel my heart's intention
Hold on, wait a minute
I left my consciousness in the sixth dimension
Left my soul in his vision
Let's go get it, oh, oh
Let's go get it, oh, oh
[Bridge]
Some people like to live
Some just tryin' to get by
Some people like that hurt
Some just rather say goodbye, bye
[Chorus]
Hold on, wait a minute
Feel my heart's intention, oh
Hold on, wait a minute
I left my consciousness in the sixth dimension
Left my soul in his vision
Let's go get it, ah, ah
Let's go get it, ah, ah
(Let's go get it)
(Mmh)
(Let's go get it)
(Mmh)"
Kali Uchis,Dead To Me,"[Intro]
(You're dead to me)
(You're dead to me)
Woo, ooh, ooh (Ooh)
Woo, ooh, ooh (Ooh)
Ooh, ooh, ooh, ooh (Ooh)
Woo, ooh, ooh
[Verse 1]
I don't know what you been told
See, I am not your enemy (Uh, oh-oh)
But if there's one thing that I know
Is that you ain't a friend to me (Uh, oh-oh)
So don't come for me unless I send for you
Know you're dead to me (Uh, oh-oh)
Just don't come for me, I won't send for you
Know you're dead to me
You're dead to me, oh
[Chorus]
You're dead to me (You're dead to me)
You're obsessed, just let me go
You're dead to me (You're dead to me)
I'm not somebody you know
You're dead to me (You're dead to me)
Could you just leave me alone?
You're dead to me
[Verse 2]
What you say to me? I can't hear a thing
Try to talk some sense to myself, but I won't listen
I'm what God made of me, don't need to pretend
It's okay to disagree, we don't have to be friends
See, you think you got problems with me?
But, baby, I don't even think about you
You're mad at everything I do
But what are you up to? I haven't a clue
'Cause, baby, you're dead to me
Why can't I be dead to you?
I think that we both know the truth
[Chorus]
You're obsessed, just let it go
You're dead to me (You're dead to me)
You're obsessed, just let me go
You're dead to me (You're dead to me)
I'm not somebody you know
You're dead to me (You're dead to me)
Could you just leave me alone?
You're dead to me (You're dead to me)
[Bridge]
Why can't you see you're dead to me?
(Wow-wow, woah, wow-wow, woah)
Just let it be, you're dead to me
(Wow-wow, woah, wow-wow, woah)
Why can't you see you're dead to me?
(Wow-wow, woah, wow-wow, woah)
Just let it be, you're dead to me
(Wow-wow, woah, wow-wow, woah)
[Chorus]
You're obsessed, just let it go
You're dead to me (You're dead to me)
You're obsessed, just let me go
You're dead to me (You're dead to me)
I'm not somebody you know
You're dead to me (Baby, you're dead to me)
Could you just leave me alone?
Baby, you're dead to me, baby, you're dead to me
[Outro]
Baby, you're—
Woah, woah
Baby, you're—"
