Artist,Title,Lyrics
Metro Boomin,I Can't Save You (Interlude) [with Future & feat. Don Toliver],"[Intro: Future & 
Young Thug
]
Ayy
I'm tweakin', I'm geekin'
I'm tweakin', I'm geekin', I can't save no ho
I'm tweakin', I'm geekin'
I'm tweakin', I'm geekin'
I'm tweakin', I'm geekin', I can't save no ho
[Verse: Don Toliver]
Met the bitch in the club and you fallin' in love and you knowin' you dead and you wrong
It's whatever, they talkin' about you whenever, don't matter, you dead and you gone
Got the drank and the tank on me
Got the gas in the gar, uh
Metro, Metro, Metro
, I got 
this
 shit here boomin'
Off the lean, the syrup, the fluid
I'ma tell you, somethin' told me to do it
Put the Perc' in your hand and you blew it
In the room and you know I get to it
Yeah, I get around, nigga, you know it
Play with me wrong, lil' nigga, I'll pull it
[Chorus: Future]
I can't save you, I can't save you, I can't save you, I can't—
I can't save you, I can't—, ayy
I can't save no ho
I can't save you, I can't save you, I can't save you, I can't save you
I can't save you, I can't save you, I can't save these hoes
Trap nigga made it to pro
I can't save no ho
Chauffeur open my door
I can't save you, ho
I can't save you, I can't—
I can't save you, I can't save you
[Outro: 21 Savage, 
Future
 & 
A$AP Rocky
]
Shawty savin' hoes
Told that boy put his cape on
Shawty-shawty savin' hoes
Told that boy put his cape on
Shawty-shawty savin' hoes
Told that boy put his cape on
I can't save these hoes
Most of these hoes don't wanna be save
d
Most of these niggas can't identify that most superheroes don't wear a cape
All villains wear a grin"
Miley Cyrus,Malibu,"[Verse 1]
I never came to the beach or stood by the ocean
I never sat by the shore under the sun with my feet in the sand
But you brought me here and I'm happy that you did
'Cause now I'm as free as birds catchin' the wind
I always thought I would sink, so I never swam
I never went boatin', don't get how they are floatin'
And sometimes I get so scared of what I can't understand
[Chorus]
But here I am, next to you
The sky's more blue in Malibu
Next to you in Malibu
Next to you (Baby)
[Verse 2]
We watched the sun go down as we were walkin'
I'd spend the rest of my life just standing here talkin'
You would explain the current as I just smile
Hoping that you'll stay the same and nothing will change
And it'll be us just for a while, do they even exist?
That's when I make a wish to swim away with the fish
'Cause it's supposed to be this hot all summer long
I never would've believed you if three years ago you told me
I'd be here writing this song
[Chorus]
But here I am, next to you
The sky's so blue in Malibu
Next to you in Malibu
Next to you (Baby)
[Bridge]
Ah, ah
Ah, ah, ah
[Chorus]
Next to you
The sky's so blue in Malibu (Baby)
Next to you (Oh, oh)
[Outro]
We are just like the waves that flow back and forth
Sometimes I feel like I'm drowning and you're there to save me
And I wanna thank you with all of my heart
It's a brand new start, a dream come true in Malibu"
Sade,Smooth Operator - Single Version,Lyrics Not Found
Metro Boomin,"Annihilate (Spider-Man: Across the Spider-Verse) (Metro Boomin & Swae Lee, Lil Wayne, Offset)","[Intro: 
Young Thug
]
(
Metro
)
[Chorus: Swae Lee]
I just came to my senses
 (Yeah)
I stay in another dimension
Fear is non-existent (Existent)
Suit up and swing through the city (Ooh, hey)
Annihilate, I'm wide awake, be very afraid (Afraid)
I'm in my own world, give me space
I'm in my own universe, give me space (Space, yeah)
[Verse 1: Lil Wayne]
Weezy Carter, I'm 'bout to go Peter Parker
I'm Spider-Man, if he ain't me, he just a creepy crawler
Tunechi spark the lighter
, pull up in a new Ferrari Spider
Spider web necklace with the diamonds
She'll turn to Spider-Woman if I bite her
I will not go back and forth with you
I see you got the black widow with you
You should've had a black hero with you
I give an opp arachnophobia
I've been litty since I flicked the lighter
Since I was an itsy bitsy spider
They've been tryna wash the spider out
I got spiders crawlin' out your mouth, Spider-Verse
[Chorus: Swae Lee]
I just came to my senses (Yeah)
I stay in another dimension
Fear is non-existent (Existent)
Suit up and swing through the city (Ooh, hey)
Annihilate, I'm wide awake, be very afraid (Afraid)
I'm in my own world, give me space
I'm in my own universe, give me space (Space, yeah)
[Verse 2: Offset]
I'm focused, I'm focused (Focused)
I'm chosen, I'm golden (Golden)
I'm stronger, on missions, ain't no foldin', a soldier (Soldier)
My vision persistent, I took the game, it's over (It's over)
I made a name, it's global (It's global), my enemy pass over (Hey)
I took the way to the top (Top), I had to learn to be smart (Smart)
I had to move with my heart, keepin' my eyes on the part
'Cause it get evil and dark (Evil and dark)
When it come to my opponents
I know how to beat 'em, I know to defeat 'em (Hey)
Livin' my life by the moment
Somebody callin', somebody gon' need 'em
[Chorus: Swae Lee]
I just came to my senses (Yeah)
I stay in another dimension
Fear is non-existent (Existent)
Suit up and swing through the city (Ooh, hey)
Annihilate, I'm wide awake, be very afraid (Afraid)
I'm in my own world, give me space
I'm in my own universe, give me space (Space, yeah)
[Verse 3: Swae Lee]
Okay, we bounce and shake, we roll and rock
I got to set it straight, the block is hot
Something's come over me, I hit unlock
And tell my enemies, ""I'll never stop""
No, no, nothing can shake me now
Tell the block I made it now
Yeah, the whole town is talking out
I swear, nothing can stop me now
All this, boosting all my senses
I won't start, but I finished
I shoot my shot, bet I won't miss it
Only way to go is go the distance
Nothing can shake me now
Nothing can break me down
Tell the whole town, we popping now
Nothing can shake me now
[Outro: Shameik Moore & 
Hailee Steinfeld
]
M.W.A. Music
This is unbelievable
This is the lobby
Oh
Welcome to Spider Society"
Metro Boomin,"Am I Dreaming (Metro Boomin & A$AP Rocky, Roisee)","[Chorus: Roisee, 
Young 
Thug
]
Not done fightin'
I don't feel I've lost
Am I dreamin'?
Is there more like us?
Got me feelin'
Like it's all too much
I feel beaten
But I can't give up
I'm still fightin' (
Metro
)
I don't feel I've lost
Am I dreamin'?
Is there more like us?
Got me feelin'
Like it's all too much
I feel beaten
But I can't give up
[Verse 1: A$AP Rocky]
Uh, wakin' up, feelin' like the thankful one
Count up my ones, lacin' up my favorite 1s
One-of-a-kind, one of one, the only one
Got one shot and one chance to take it once
Kiss my mama on the forehead, 'forе I get the code rеd
'Cause I was born, bred to go in, toast ready
Swing by 410, beef patty, cornbread
In the concrete jungle, where my home is
All get focused, all raise your toastes
The nickname: Mr. Keen-To-Do-the-Mostest
I was livin' down bad in my folks' crib
Now I'm laughin' to the bank and the joke is
Did more things than folks did, or folks get
We been gettin' this fly since some poor kids
My rich friends and my broke friends coexist
They love to mix, and we know what it is
[Chorus: Roisee]
Not done fightin'
I don't feel I've lost
Am I dreamin'?
Is there more like us?
Got me feelin'
Like it's all too much
I feel beaten
But I can't give up
I'm still fightin'
I don't feel I've lost
Am I dreamin'?
Is there more like us?
Got me feelin'
Like it's all too much
I feel beaten
But I can't give up
[Verse 2: Roisee]
I can't find it in myself
To just walk away
I can't find it in myself
To lose everything
Feel everyone's against me, don't
Want me to be great
Things might look bad, not afraid
To look death in the face
I'm good now (Now, now)
Who's really bad?
I choose me now (Now, now)
What's wrong with that?
Wish you could see me now, now
Mmm, who had my back?
Ain't belong, no love lost
Good always will win
[Chorus: Roisee]
Not done fightin' (Fightin')
I don't feel I've lost (Feel I've)
Am I dreamin'? (Dreamin')
Is there more like us?
 (More like)
Got me feelin' (Feelin')
Like it's all too much
I feel beaten (Beaten)
But I can't give up (Can't give)
I'm still fightin'
I don't feel I've lost
Am I dreamin'?
Is there more like us?
Got me feelin'
Like it's all too much
I feel beaten
But I can't give up (Can't give)
[Outro: Roisee]
Up
Can't give, can't give
Up
Can't give, can't give
Up
Can't give, can't give
Up
Can't give up"
Katy Perry,Harleys In Hawaii,"[Verse 1]
Boy, tell me, can you take my breath away?
Cruisin' down a heart-shaped highway
Got you swervin' lane-to-lane, don't hit the brakes
'Cause I'm feelin' so safe
[Pre-Chorus]
I'll be your baby, on a Sunday
Oh, why don't we get out of town?
Call me your baby, on the same wave
Oh, no, no, there's no slowin' down
[Chorus]
You and I, I
Ridin' Harleys in Hawaii-i-i
I'm on the back, I'm holdin' tight, I
Want you to take me for a ri-ide, ride
When I hula-hula, hula
So good, you'll take me to the jeweler-jeweler, jeweler
There's pink and purple in the sky-y-y
We're ridin' Harleys in Hawaii-i-i (Ha)
[Verse 2]
Let me run my fingers through your salty hair
Go ahead, explore the island
Vibes so real that you can feel it in the air
I'm revvin' up your engine
[Pre-Chorus]
I'll be your baby, on a Sunday
Oh, why don't we get out of town? (Why don't we get out of town?)
Call me your baby, catch the same wave
Oh, no, no, there's no slowin' down (Let's go)
[Chorus]
You and I, I
Ridin' Harleys in Hawaii-i-i
I'm on the back, I'm holdin' tight, I
Want you to take me for a ri-ide, ride
When I hula-hula, hula
So good, you'll take me to the jeweler-jeweler, jeweler (Jeweler)
There's pink and purple in the sky-y-y (No, no ,no)
We're ridin' Harleys in Hawaii-i-i
[Bridge]
(Ah-ooh)
No, no
(Ooh)
[Chorus]
You and I...
You and I, I
Ridin' Harleys in Hawaii-i-i
I'm on the back, I'm holdin' tight, I
Want you to take me for a ri-ide, ride (Oh)
When I hula-hula, hula
So good, you'll take me to the jeweler-jeweler, jeweler (Jeweler)
There's pink and purple in the sky-y-y
We're ridin' Harleys in Hawaii-i-i
[Outro]
I'll be your baby, on a Sunday (Ah-ooh)
Oh woah
We're ridin' Harleys in Hawaii-i
Call me your baby, catch the same wave (Ooh)
Oh woah
We're ridin' Harleys in Hawaii-i"
Beach House,Lemon Glow,"[Verse 1]
Read my fortune too
Tell me what you see
Cross it like a T
It's all the same to me
This game I play
I do it every day
Then promise I'll be fine
Bear it every time
[Refrain]
When you turn the lights down low
Lemon color, honey glow
[Verse 2]
See this state I'm in
Is crawling in my skin
Fevers took me back
And turned me inside out
[Refrain]
When you turn the lights down low
Lemon color, honey glow
[Chorus]
It's what you do
This pulls me through
To the other end
Where it begins
You see through me
Still, it's coming back
I come alive
You stay all night
[Bridge]
You feel it coming right through you
The color of your mind
The color of your mind
The color of your mind
You feel it coming right through you (You feel it coming right through you)
It's on the other side
It doesn't have to be this way (Doesn't have to be this way)
The color of your mind
[Chorus]
It's what you do
This pulls me through
I come alive
You stay all night
It's what you do
This pulls me through
I come alive
You stay all night
[Outro]
Candy-colored misery
The color of your mind"
Grimes,4ÆM,"[Intro]
O—
Aphrodite
I wrote your constellation
Into the sky
S-s-s-s-s-sa
Suns at night
[Chorus]
I'm out late at 4 AM
He says, ""How's the weather, baby? How've you been?""
You're gonna get sick, you don't know when
I never doubt it at 4 AM
I'm out late at 4 AM
He says, ""How's the weather, baby? How've you been?""
You're gonna get sick, you don't know when
I never doubt it at 4 AM
[Post-Chorus]
4 AM, 4 AM
Falling down again
Unraveling
[Bridge]
Aphrodite
I wrote your constellation
Into the sky, ooh
S-s-s-s-s-sa
Suns at night
[Chorus]
I'm out late at 4 AM
He says, ""How's the weather, baby? How've you been?""
You're gonna get sick, you don't know when
I never doubt it at 4 AM
I'm out late at 4 AM
He says, ""How's the weather, baby? How've you been?""
You're gonna get sick, you don't know when
I never doubt it at 4 AM
[Post-Chorus]
Na-na-na, na-na-na, na-na-na, na-na-na, ah
Na-na-na, na-na-na, na-na-na, na-na-na, ah
4 AM, 4 AM
Falling down again
[Chorus]
I'm out late at 4 AM (4 AM)
He says, ""How's the weather, baby? How've you been?"" (How you've been?)
You're gonna get sick, you don't know when
I never doubt it at 4 AM (Doubt it, 4 AM)
I'm out late at 4 AM (Doubt it)
He says, ""How's the weather, baby? How've you been?"" (How you've been?)
You're gonna get sick (Falling down again), you don't know when
I never doubt it at 4 AM (4 AM)
[Outro]
4 AM, 4 AM, 4 AM, 4 AM
4 AM, 4 AM, 4 AM, 4 AM
4 AM, 4 AM, falling down again
4 AM, 4 AM, falling down again
I'm out late at 4 AM
4 AM, 4 AM, out late at 4 AM
I'm out late at 4 AM
4 AM, 4 AM, 4 AM
I'm out late at 4 AM, oh, oh
Falling down again
Falling down again
Oh"
Hailee Steinfeld,Coast (feat. Anderson .Paak),"[Intro: Anderson .Paak]
Coast
[Verse 1: Hailee Steinfeld]
You're the wave upon my ocean
Poundin' rhythm and motion
It's a full moon kind of night, yeah
I don't wanna go home yet
You can question my devotion
Wear my heart on my shoulder
Just relax and let the riptide pull you close
[Chorus: Hailee Steinfeld & 
Anderson .Paak
]
(Ah)
Baby, all I wanna do is coast (
Coast
)
With you (
You
)
Energy, the body flows
(Ah, 
hey, hey
)
Baby, all I wanna do is coast (
Coast
)
With you (
You
)
Frequency of all we know (
Yeah
)
[Verse 2: Anderson .Paak]
Feelin' like I caught a wave with ya
I've been dealin' with a lot of changes
And all the people that I like to hang with
They all been sayin' that I ain't the same
Listen, I been chillin' with you for a couple days
If you ain't afraid, me and you should rage (Rage)
In the Sun rays (Rays), come on out the cage (Cage)
Don't wanna tame, live it your way (Ayy)
Body go for days (Days), got me in a daze (Daze)
Parties in L.A. (A) feel like holidays
Hit the PCH and we on our way
To a place I was born and raised
You live on the screen and the stage
I wanna fit in between your legs
Let's pick a day, everything could wait
Words can't relay, but it's givin' fate
[Chorus: Hailee Steinfeld & 
Anderson .Paak
]
(Ah)
Baby, all I wanna do is coast (
Coast
)
With you (
You
)
Energy, the body flows
(Ah, 
hey, hey
)
Baby, all I wanna do is coast (
Coast
)
With you (
You
)
Frequency of all we know (
Coast
)
[Post-Chorus: Hailee Steinfeld & 
Anderson .Paak
]
'Cause nothin' feels as real when we're connected (
Coast
)
Relax and let the riptide pull you close
(Ah)
Baby, all I wanna do is coast (
Coast
)
With you (
You
)
Frequency of all we know
[Bridge: Hailee Steinfeld & 
Anderson .Paak
]
The stars come down, you drown 'em out
I'm sinkin' deeper into you
I breathe you in, I breathe you out
I'm sinkin' deeper into (
Hey
)
[Chorus: Hailee Steinfeld & 
Anderson .Paak
]
(Ah)
Baby, all I wanna do is coast (
Coast
)
With you (
With you
)
Energy, the body flows (
We could cruise if the mood's right
)
(Ah, 
catch a wave in the moonlight
)
Baby, all I wanna do is coast (
Coast
)
With you (
With you
)
Frequency of all we know (
Coast
)
[Post-Chorus: Hailee Steinfeld & 
Anderson .Paak
]
'Cause nothin' feels as real when we're connected (
Coast
)
Relax and let the riptide pull you close
(Ah)
Baby, all I wanna do is coast (
Coast
)
With you (
With you
)
Frequency of all we know"
Don Toliver,"Givin’ Up (Not The One) (Don Toliver & 21 Savage, 2 Chainz)","[Intro: Oscar Isaac]
But I'm not like the others
I don't always like what I have to do 
(
Honorable C.N.O.T.E.
)
But I know I have to be the one to do it
I've given up too much to stop now
[Chorus: Don Toliver]
I can't be the one here givin' up
I'm not the one here givin' up (No)
Time heals all, but I can't feel what it was
If you were me, you wouldn't give up
I'm not the one here givin' up (I'm not the one here givin' up)
I'm not the one here givin' up (I'm not the one herе givin' up)
I'm not the one herе givin' up (I'm not the one here givin' up)
I'm not the one here givin' up (I'm not the one here givin' up)
[Verse 1: 21 Savage]
Woah, woah
Every obstacle I overcame
Pushed through it, I ain't pointin' blame
Kept my focus
Every time they tried to hold me back I broke up out they chains
Reached the top and still remained the same
Hit the bottom, get up, no complain
Walk on the stage and they yell my name
They doubt me, but I always do my thing
'Cause they count on me (21)
I got a family to feed (21)
Duckin' the envy and greed (On God)
Street smart, but I still read (On God)
Give birth to heroes, I breed (21)
I smell a win and get tea (21)
Let down the top, feel the breeze (Straight up)
How you gon' give up on me? (On God)
How you just give up on we? (21)
I'd never quit, though
Got a house now, I started with a brick, though
 (Facts)
Say you hungry, all you wanna do is sit, though (Facts)
I'm a leader, I'll show you how to fish, though (21)
If you want it, there's some things you gon' miss, though (21)
I got goals everybody ain't built for (21)
I ain't stoppin' 'til I get what I'm here for (On God)
[Chorus: Don Toliver]
I can't be the one here givin' up
I'm not the one here givin' up (No)
Time heals all, but I can't feel what it was
If you were me, you wouldn't give up
I'm not the one here givin' up (I'm not the one here givin' up)
I'm not the one here givin' up (I'm not the one here givin' up)
I'm not the one here givin' up (I'm not the one here givin' up)
I'm not the one here givin' up (I'm not the one here givin' up)
[Verse 2: 2 Chainz]
Yeah, 2 Chainz
Love me or love me not, link at the gamma spot
Up front, we work, that was a hand-me-down
I wasn't stunned, I'll make 'em stand around
I got a stick with a bandana 'round (Ah)
Never gave up on me, I own your favorite OG
Make your baby OD when she on me
Told him, ""In my time,"" just so you know I ain't lyin'
I bought my whole clique, some new Rollies
Alone, never lonely
Rock with the real, never phony
Do 24 like I'm Kobe
My superhero, was goated
It was the street that had molded me
I got a caught in a web (Web)
I got new thoughts on the head
'Member the floor was the bed
You know I heard what you said
Now when I'm droppin' the top
Don't let that go over your head
[Chorus: Don Toliver & 
2 Chainz
]
I can't be the one here givin' up 
(
Yeah, Toni
)
I'm not the one here givin' up (No)
Time heals all, but I can't feel what it was
If you were me, you wouldn't give up (
Mmm
)
I'm not the one here givin' up (I'm not the one here givin' up)
I'm not the one here givin' up (I'm not the one here givin' up)
I'm not the one here givin' up (
True
, I'm not the one here givin' up)
I'm not the one here givin' up (I'm not the one here givin' up, 
tell 'em
)
[Outro: Don Toliver & 
Oscar Issac
]
Fair enough
Is part of your life (Is part of your life)
I see you runnin' out of time
Is part of your life (Is part of your life)
Being Spider-Man is a sacrifice
That's the job, that's what you signed up for"
ruinedbymateo,Sovereign,Lyrics Not Found
Farinas,You Get Me So High,"[Intro]
You get me so high
I forget who I am
And as time goes by
I need you
I need you to stay
You get me so high
I forget who I am
And as time goes by
I need you
I need you to stay
Oh - oh -oh
[Verse 1]
I wish we could live forever
Cuz' I think I missed my last chance
I ain't been sleeping no better
So ima drink till I can't stand
[Chorus]
You told me no need to get up, the weather was fine
But [?] umbrella
So im feelin-
Shine, found what I lost
There was my mind
Go through the fog and I see the light
Shouts to my guys, shouts to my fam
And my [?]
Smile lookin' white, smile lookin' fine
Was caught in a spiral, now I realign
Floatin' on a spiral
And I'll win this fight
Baby, I dont know
[Outro]
Im doin' fine
Im doin' fine
Im doin' fine
Im doin'
Im doin'
You get me so high
I forget who I am
And as time goes by
I need you
I need you to stay
You get me so high
I forget who I am
And as time goes by
I need you
I need you to stay
You get me so high
I forget who I am
And as time goes by
I need you
I need you to stay
Oh - oh- oh"
SEB,loving u is harder,"[Verse 1]
Every single day I'm catching feelings
For a different you
I'ma stain my sweater
'Cause I've never been invincible
I'ma tell the truth
But baby you can't catch an attitude
We've been living larger than the stars
But we're miserable
[Pre-Chorus]
How you getting mad
When you the only one who got caught?
How am I taking all the blame
When it wasn't my fault?
I'm the one who's dropping
Them tears on the asphalt
I'm the one who drove all the way here
Now you can't talk
[Chorus]
Loving you is harder than I thought
You got a reputation breaking hearts
Guess I should've saw this from the start
A pretty face, you such a work of art
[Verse 2]
I been here for a minute
I know you independent
You on your own time
You tried to squeeze me in it
And if you really cared
Maybe you'd be really there
You said I made you do it
That ain't really fair
[Pre-Chorus]
How you getting mad
When you the only one who got caught?
How am I taking all the blame
When it wasn't my fault?
I'm the who's dropping
Them tears on the asphalt
I'm the one who drove all the way here
Now you can't talk
[Chorus]
Loving you is harder than I thought
You got a reputation breaking hearts
Guess I should've saw this from the start
A pretty face, you such a work of art
[Bridge]
You tryna fall in love with somebody new, new, new
Tryna to forget about me this afternoon, noon, noon
I hope that your petty wishes come true, true, true
Even when it doesn't I'ma come through, through, through, through
[Instrumental Break]
[Chorus]
Loving you is harder than I thought
You got a reputation breaking hearts
Guess I should've saw this from the start
A pretty face, you such a work of art
Loving you is harder than I thought
You got a reputation breaking hearts
Guess I should've saw this from the start
A pretty face, you such a work of art"
NEZZA,Poison,"[Verse 1]
Tell me baby
Is this what you want
Feel you starin', your heartbeat speedin' up
If you come closer might just risk it all
Tell me baby, yeah
[Pre-Chorus]
You try and play it cool (Yeah, yeah)
But I got the moves
Keep you comin'
Beggin' me for more (Yeah, yeah)
I guess you might be my next victim
[Chorus]
I got you right where
Right where I want
I’m in your nightmares
Still feel me breathin'
When I’m not there
You don’t deserve it
But I’ll give it, I’ll give it to you
I got you right where
Right where I want
I’m in your nightmares
Still feel me brеathin'
When I’m not there
You don’t dеserve it
But I’ll give it, I’ll give it to you
[Verse 2]
Boy, I know that
What you want I got it
One drop is enough
My love is poison
Lick it up, lick it up
That’s the antidote
Give it up, give it up
Cause one drop is enough
My love is poison
[Pre-Chorus]
You try and play it cool (Yeah, yeah)
But I got the moves
Keep you comin'
Beggin' me for more (Yeah, yeah)
I guess you might be my next victim
[Chorus]
I got you right where
Right where I want
I’m in your nightmares
Still feel me breathin'
When I’m not there
You don’t deserve it
But I’ll give it, I’ll give it to you
I got you right where
Right where I want
I’m in your nightmares
Still feel me breathin'
When I’m not there
You don’t deserve it
But I’ll give it, I’ll give it to you
[Bridge]
Give you that poison
Running all through your body
Killing you slowly
And I’m just getting started
I got what you need, right now
Bow down to a queen, right now
Yeah I got what you need, right now
Bow down to a queen, right now
I'm your favorite angel
With my devil tendencies
On your lips you get to keep a little taste of me
[Chorus]
I got you right where
Right where I want
I’m in your nightmares
Still feel me breathin'
When I’m not there
You don’t deserve it
But I’ll give it, I’ll give it to you
[Outro]
Give you that poison
Running all through your body
Killing you slowly
And I’m just getting started, yeah"
Joji,Run,"[Verse 1]
I fell for your magic, I tasted your skin
And though this is tragic, at least I found the end
I witnessed your madness, you shed light on my sins
And if we share in this sadness, then where have you been?
[Chorus]
I know you're not in love like you used to be
Guess I’m not the one, like you used to think
So you'll just run
I know that I'm stuck in this misery
Guess I’m not enough, like you used to think
So I'll just run (Ooh)
[Verse 2]
You bathe in your victory
You blew out on my fuse
And if I took on the planet
Will I pay my dues?
Your love was a mystery
Yeah, my love is a fool
And I traveled the country just to get to you
[Chorus]
I know you're not in love like you used to be
Guess I'm not the one, like you used to think
So you'll just run
I know that I'm stuck in this misery
Guess I'm not enough, like you used to think
So I'll just run
[Outro]
And I traveled the country
And I traveled the country just to get to you
I know you’re not in love
I know you’re not in love
I know you're not in love"
